### ISSUE TITLE
Auto reconnected client doesn't publish when HiveMQ Server restarted.

### ISSUE THREAD

**Issue by endevcy** [hivemq/hivemq-mqtt-client#350]
## To Reproduce

Under HiveMQ server on docker,
if I restart docker container like

> docker restart {id of HiveMQ}

mqtt client doesn't publish anymore.
I used Mqtt3Client.builder() with automaticReconnectWithDefaultConfig() option.

when HiveMQ server down, client.getState().isConnected() show false.
After some seconds of reboot time, client.getState().isConnected() become true.
But when client tries to publish like this,

>   client.publishWith()topic(topic).qos(qos).payload(payload).send();

it doesn't publish and blocked. 
I also tried with 

> client.toAsync().....and.send();  

It doesn't block anymore. But it doesn't send publish as well. 

I also checked packets using Wireshark. Before the restart of docker, I can see like this

527798	6325.547886	127.0.0.1	127.0.0.1	MQTT	375	Publish Message [topic/abcd]
527799	6325.547901	127.0.0.1	127.0.0.1	TCP	56	1883 → 54502 [ACK] Seq=10 Ack=6946 Win=401344 Len=0 TSval=1639275964 TSecr=1639275964

After the restart, I could see only ping-pong.

2362679	12083.809819	127.0.0.1	127.0.0.1	MQTT	58	Ping Request
2362680	12083.809838	127.0.0.1	127.0.0.1	TCP	56	1883 → 57726 [ACK] Seq=39 Ack=83 Win=408192 Len=0 TSval=1644980570 TSecr=1644980570
2362681	12083.811848	127.0.0.1	127.0.0.1	MQTT	58	Ping Response
2362682	12083.811874	127.0.0.1	127.0.0.1	TCP	56	57726 → 1883 [ACK] Seq=83 Ack=41 Win=408256 Len=0 TSval=1644980572 TSecr=1644980572

So I assured that after the restart of HiveMQ server, client tried auto reconnection but it doesn't behave as expected.

Any idea will be helpful.

## Details
- Affected HiveMQ MQTT Client version(s): 1.1.0
- Used JVM version:

**Comment by endevcy** [comment]
For more information, when I debugged line by line, the difference before and after HiveMQ server restart was after calling MqttOutgoingQosHandler.class's line 166.

> queue.offer(publishWithFlow);

I think the method in the line 199

> public void run() {

should be called but it didn't.

**Comment by SgtSilvio** [comment]
Hi @endevcy 
This is not behavior we have seen before.
To be able to help here, please answer a couple of questions.
- Do you have a reproducer code?
- Which QoS level are you using?
- Are you using persistent sessions?
- How did you observe that the call to publish never completed and blocked?

**Comment by endevcy** [comment]
Hi SgtSilvio, thanks for your answer. I tested a little bit more and I found publish was not a problem. It was because of auto re-subscribe after reconnection. Let me close this issue and create another issue to ask a question.
